{
  "$schema": "http://json-schema.org/draft-07/schema#",
  "$id": "https://schemas.hl7v2-rs.org/evidence/validation-report/v1",
  "title": "HL7v2 Validation Report",
  "description": "Machine-readable validation report shared by CLI, Rust, server, and Python surfaces.",
  "type": "object",
  "additionalProperties": false,
  "required": ["valid", "message_type", "segment_count", "issue_count", "issues"],
  "properties": {
    "valid": {
      "type": "boolean",
      "description": "Whether the message passed validation without error-level issues."
    },
    "message_type": {
      "type": "string",
      "description": "HL7 trigger event from MSH.9, such as ADT^A01."
    },
    "profile": {
      "type": "string",
      "description": "Profile identifier, usually a path or loaded message structure."
    },
    "segment_count": {
      "type": "integer",
      "minimum": 0,
      "description": "Number of parsed message segments."
    },
    "issue_count": {
      "type": "integer",
      "minimum": 0,
      "description": "Number of validation issues in this report."
    },
    "issues": {
      "type": "array",
      "items": {
        "$ref": "#/definitions/validation_issue"
      }
    }
  },
  "definitions": {
    "validation_issue": {
      "type": "object",
      "additionalProperties": false,
      "required": ["code", "severity", "message"],
      "properties": {
        "code": {
          "type": "string",
          "pattern": "^[a-z][a-z0-9_]*$",
          "description": "Stable snake_case issue code."
        },
        "severity": {
          "type": "string",
          "enum": ["error", "warning"]
        },
        "path": {
          "type": "string",
          "description": "HL7 path associated with the issue, such as PID.3."
        },
        "rule_id": {
          "type": "string",
          "description": "Stable validation rule identifier."
        },
        "message": {
          "type": "string",
          "description": "Human-readable issue message."
        },
        "segment_index": {
          "type": "integer",
          "minimum": 0,
          "description": "Zero-based segment index when known."
        },
        "field_index": {
          "type": "integer",
          "minimum": 1,
          "description": "One-based HL7 field index when known."
        }
      }
    }
  }
}
